{"approval":{"manifest":{"api":{"approved_ref":"refs/heads/main","commit_sha":"1111111111111111111111111111111111111111","repository":"PluckXD/tratto-api","required_ancestors":["2222222222222222222222222222222222222222"]},"controller":{"approved_ref":"refs/heads/main","base_sha":"3333333333333333333333333333333333333333","repository":"PluckXD/tratto-control-release","workflow_path":".github/workflows/control-release.yml","workflow_sha256":"4444444444444444444444444444444444444444444444444444444444444444"},"expires_at":"2026-08-01T13:00:00Z","issued_at":"2026-08-01T12:00:00Z","migration":{"base_revision":"j1transpcod","database_scope":"control-and-tenant-fleet","fleet_preflight_sha256":"5555555555555555555555555555555555555555555555555555555555555555","head_revision":"f29controlexec","mode":"expand-only","tenant_catalog_count":1,"tenant_catalog_sha256":"6666666666666666666666666666666666666666666666666666666666666666","tenant_fleet_base_revision":"j1transpcod"},"nonce":"AAAAAAAAAAAAAAAAAAAAAA","ops":{"approved_ref":"refs/heads/main","commit_sha":"1111111111111111111111111111111111111111","repository":"PluckXD/tratto-api","required_ancestors":["7777777777777777777777777777777777777777"]},"policy":{"digest_sha256":"8888888888888888888888888888888888888888888888888888888888888888","name":"control-production-v1","path":"policies/control-production-v1.json","repository":"PluckXD/tratto-control-release"},"release_id":"ctl-20260801T120000Z-tests","schema_version":1,"web":{"approved_ref":"refs/heads/main","commit_sha":"9999999999999999999999999999999999999999","repository":"PluckXD/tratto-web","required_ancestors":["aaaaaaaaaaaaaaaaaaaaaaaaaaaaaaaaaaaaaaaa"]}},"manifest_sha256":"dee85a8e587932115cd7117c998b513bc7d3b17f7b0e568a8643e35b144dab3b","mode":"protected-public-controller"},"artifacts":{"api":{"ancestor_verified":true,"approved_ref":"refs/heads/main","artifact_id":1,"artifact_name":"tratto-control-api-1111111111111111111111111111111111111111.tar.gz","build_job":"build_api","carrier_repository":"PluckXD/tratto-control-release-carrier","commit_sha":"1111111111111111111111111111111111111111","component_manifest_sha256":"bbbbbbbbbbbbbbbbbbbbbbbbbbbbbbbbbbbbbbbbbbbbbbbbbbbbbbbbbbbbbbbb","repository":"PluckXD/tratto-api","runner_arch":"X64","runner_environment":"github-hosted","runner_os":"Linux","service_digest":"eeeeeeeeeeeeeeeeeeeeeeeeeeeeeeeeeeeeeeeeeeeeeeeeeeeeeeeeeeeeeeee","sha256":"1111111111111111111111111111111111111111111111111111111111111111","size_bytes":101,"tree_sha":"4444444444444444444444444444444444444444"},"ops":{"ancestor_verified":true,"approved_ref":"refs/heads/main","artifact_id":2,"artifact_name":"tratto-control-ops-1111111111111111111111111111111111111111.tar.gz","build_job":"build_ops","carrier_repository":"PluckXD/tratto-control-release-carrier","commit_sha":"1111111111111111111111111111111111111111","component_manifest_sha256":"cccccccccccccccccccccccccccccccccccccccccccccccccccccccccccccccc","repository":"PluckXD/tratto-api","runner_arch":"X64","runner_environment":"github-hosted","runner_os":"Linux","service_digest":"ffffffffffffffffffffffffffffffffffffffffffffffffffffffffffffffff","sha256":"2222222222222222222222222222222222222222222222222222222222222222","size_bytes":102,"tree_sha":"5555555555555555555555555555555555555555"},"web":{"ancestor_verified":true,"approved_ref":"refs/heads/main","artifact_id":3,"artifact_name":"tratto-control-web-9999999999999999999999999999999999999999.tar.gz","build_job":"build_web","carrier_repository":"PluckXD/tratto-control-release-carrier","commit_sha":"9999999999999999999999999999999999999999","component_manifest_sha256":"dddddddddddddddddddddddddddddddddddddddddddddddddddddddddddddddd","repository":"PluckXD/tratto-web","runner_arch":"X64","runner_environment":"github-hosted","runner_os":"Linux","service_digest":"aaaaaaaaaaaaaaaaaaaaaaaaaaaaaaaaaaaaaaaaaaaaaaaaaaaaaaaaaaaaaaaa","sha256":"3333333333333333333333333333333333333333333333333333333333333333","size_bytes":103,"tree_sha":"6666666666666666666666666666666666666666"}},"behavioral_verification":{"api_sha":"1111111111111111111111111111111111111111","artifacts":{"api":{"artifact_id":1,"component_manifest_sha256":"bbbbbbbbbbbbbbbbbbbbbbbbbbbbbbbbbbbbbbbbbbbbbbbbbbbbbbbbbbbbbbbb","service_digest":"eeeeeeeeeeeeeeeeeeeeeeeeeeeeeeeeeeeeeeeeeeeeeeeeeeeeeeeeeeeeeeee","sha256":"1111111111111111111111111111111111111111111111111111111111111111"},"ops":{"artifact_id":2,"component_manifest_sha256":"cccccccccccccccccccccccccccccccccccccccccccccccccccccccccccccccc","service_digest":"ffffffffffffffffffffffffffffffffffffffffffffffffffffffffffffffff","sha256":"2222222222222222222222222222222222222222222222222222222222222222"},"web":{"artifact_id":3,"component_manifest_sha256":"dddddddddddddddddddddddddddddddddddddddddddddddddddddddddddddddd","service_digest":"aaaaaaaaaaaaaaaaaaaaaaaaaaaaaaaaaaaaaaaaaaaaaaaaaaaaaaaaaaaaaaaa","sha256":"3333333333333333333333333333333333333333333333333333333333333333"}},"browser_report_sha256":"ffffffffffffffffffffffffffffffffffffffffffffffffffffffffffffffff","contracts":{"api_auth_surface_http":true,"api_business_denylist_http":true,"api_p2t_password_ack_http":true,"api_reset_endpoint_http":true,"edge_reset_url_redaction_http":true,"ops_tree_digest_verified":true,"web_exact_hostname_http":true,"web_reset_fragment_browser":true,"web_surface_denylist_http":true},"observations":{"api_anonymous_me":401,"api_business_deny":404,"api_health":200,"api_internal_deny":404,"api_p2t_password_ack_exists":401,"api_reset_exact":400,"api_reset_legacy":404,"edge_reset_legacy":404,"edge_reset_query":404,"web_business_deny":404,"web_login":200,"web_reset_exact":200,"web_reset_legacy":404,"web_wrong_host":421},"schema_version":3,"verdict":"pass","web_sha":"9999999999999999999999999999999999999999"},"carrier":{"authorizes_release":false,"repository":"PluckXD/tratto-control-release-carrier","trust":"transport-only"},"controller":{"commit_sha":"bbbbbbbbbbbbbbbbbbbbbbbbbbbbbbbbbbbbbbbb","event_name":"workflow_dispatch","repository":"PluckXD/tratto-control-release","run_attempt":1,"run_id":123,"runner_arch":"X64","runner_environment":"github-hosted","runner_os":"Linux","source_ref":"refs/heads/main","verifier_sha256":"cccccccccccccccccccccccccccccccccccccccccccccccccccccccccccccccc","workflow":".github/workflows/control-release.yml","workflow_ref":"PluckXD/tratto-control-release/.github/workflows/control-release.yml@refs/heads/main"},"migration":{"base_revision":"j1transpcod","database_scope":"control-and-tenant-fleet","fleet_preflight_sha256":"5555555555555555555555555555555555555555555555555555555555555555","head_revision":"f29controlexec","mode":"expand-only","tenant_catalog_count":1,"tenant_catalog_sha256":"6666666666666666666666666666666666666666666666666666666666666666","tenant_fleet_base_revision":"j1transpcod"},"schema_version":5,"supplemental_inventory":{"supplemental_only":true}}
